{
  "status": "success",
  "provider": "workspace",
  "path": "workspace/empty-draft.txt",
  "content_hash": "sha256:e3b0c44298fc1c149afbf4c8996fb92427ae41e4649b934ca495991b7852b855",
  "bytes_written": 0,
  "created": true,
  "evidence_refs": ["ev_empty_draft"],
  "artifact_refs": [],
  "warnings": []
}
